599|00046200012177|046200012177|Covergirl|Covergirl Outlast All-day Lipcolor 517 Red Hot
600|00014500012807|014500012807|Birds Eye|Birds Eye Steamfresh Whole Grain Brown Rice
601|00033900000511|033900000511|Jones Dairy Farm|Jones Hearty Pork Sausage Links
602|00041520876621|041520876621|Careone|Careone Cocoa Butter Lotion
603|00075609600647|075609600647|Olay|Olay Regenerist Night Recovery Cream 1.7 Oz
604|00041000022531|041000022531|Knorr|Knorr Pasta Sides Alfredo
605|00027000419137|027000419137|Snack Pack|Snack Pack Chocolate Fudge Pudding - 4 Ct
606|00028400028141|028400028141|Munchies|Munchies Cheese Fix Rold Gold, Doritos, Cheetos, Sun Chips Snack Mix
607|00077260003614|077260003614|Russell Stover|Russell Stover Strawberry Cream Egg In Milk Chocolate
608|00708971916794|708971916794|Lofthouse|Lofthouse Frosted Sugar Cookies - 10 Ct
609|00071169208958|071169208958|Betty Crocker|Betty Crocker Happy Birthday Candles - 13 Ct
610|00346581700015|346581700015|Salonpas|Salonpas-hot Capsicum Patch
611|00012000018817|012000018817|Pepsi|Pepsi Max Zero Calorie
612|00038000403408|038000403408|Eggo|Kellogg's Eggo Strawberry Waffles- 10 Ct
613|00710363580384|710363580384|Applied Nutrition|Applied Nutrition Green Tea Fat Burner Dietary Supplement Tablets - 40 Ct
614|00053076103267|053076103267|Fungi Nail|Fungi Nail Maximum Strength Anti-fungal Solution
615|00020735092866|020735092866|Turkey Hill|Turkey Hill Lemonade
616|00636874090740|636874090740|Eo Products|Eo Products Shower Gel Soothing French Lavender - 16 Fl Oz
617|00071305072566|071305072566|Maier's|Maier's Premium Italian Kaiser Rolls - 8 Ct
618|00689544080336|689544080336|Fage|Fage Total 0% All Natural Mango Guanabana Nonfat Greek Strained Yogurt
619|00688267035180|688267035180|Ahold|Ahold Homestyle Mushroom Gravy
620|00041262284074|041262284074|Wise|Wise New York Deli Potato Chips Kettle Cooked Jalapeno
621|00052000131192|052000131192|Gatorade|Gatorade Fit Series 03 Recover Strawberry Banana Protein Restorative Smoothie
622|00688267122446|688267122446|Ahold|Ahold Instant Mashed Potatoes Sour Cream & Chive - 2 Ct
623|00310119032220|310119032220|Re-nu|Bausch + Lomb Re-nu Fresh Multi-purpose Solution
624|00688267141911|688267141911|Nature's Promise|Nature's Promise Milk Chocolate Sea Salt Caramels
625|00041331032469|041331032469|Goya|Goya Chicken Bouillon Powdered
626|00027000419229|027000419229|Snack Pack|Snack Pack Juicy Gels Strawberry - 4 Pk
627|00811435002176|811435002176|Chore Boy|Chore Boy Golden Fleece Scrubbing Cloths - 2 Ct
628|00787359559211|787359559211|The Better Chip|The Better Chip Corn With Sea Salt Corn Chips
629|00851087000557|851087000557|Peanut Butter & Co.|Peanut Butter & Co. All Natural Old Fashioned Peanut Butter Cookies Baking Mix
630|00013800654557|013800654557|Lean Cuisine|Lean Cuisine Culinary Collection Sesame Chicken
631|00852584000316|852584000316|The Buffalo Guys|The Buffalo Guys Ground Buffalo Burgers 1/4 Lb Ea
632|00071623479115|071623479115|Jeanmarie Creations|Jeanmarie Creations Valentine Gift Box
633|00000000004065|000000004065|Peapod|Peppers Bell Green
634|00016300153582|016300153582|Florida's Natural Growers|Donald Duck Original No Pulp 100% Pure Orange Juice
635|00051000195654|051000195654|Campbell's|Campbell's Homestyle Soup Southwest-style Potato With Green Chilies & Cheese
636|00071153785717|071153785717|Stp|Stp Fuel Injector & Carburetor Treatment
637|00031142359022|031142359022|Belgioioso|Belgioioso Parmesan Cheese Freshly Shredded
638|00688267134036|688267134036|Ahold|Ahold Cranberry Bread
639|00041520864697|041520864697|Careone|Careone Super Tampons - 20 Ct
640|00219744500008|219744500008|Usda Produce|Grapes Green Seedless Organic
641|00071463023417|071463023417|Learning Curve|Learning Curve 6+mo Stacking Cups
642|00021200010538|021200010538|Scotch|Scotch Permanent Mounting Tape
643|00024600078344|024600078344|Morton|Morton Pet Care Ice Melt Safe T Pet
644|00017873705123|017873705123|Blake's|Blake's Chicken Pot Pie
645|00073166892178|073166892178|Mee Tu|Mee Tu Wasabi Peas Specialty Asian Snax
646|00036000413175|036000413175|Goodnites|Goodnites Bedtime Underwear Boys S-m - 31 Ct
647|00000000432436|000000432436|Usda Produce|Melon Galia
648|00017400101404|017400101404|Carolina|Carolina Rice
649|00033674145005|033674145005|Nature's Way|Nature's Way Kelp 600mg Capsules - 100 Ct
650|00033776011758|033776011758|Earth Balance|Earth Balance Organic Coconut Spread
651|00015000127565|015000127565|Gerber|Gerber Smart Nourish 2nd Foods Organic Apple Sweet Potato - 2ct
652|00016000450677|016000450677|Cheerios|Cheerios Protein Cereal Cinnamon Almond
653|00042037103170|042037103170|Fiber Choice|Fiber Choice Bone Health Prebiotic Fiber Supplement Sugar-free Chewable Tablets Assorted Berry - 90 Ct
654|00045200080902|045200080902|Cains|Naturally Delicious Raspberry Vinaigrette Dressing Light
655|00074182151010|074182151010|Softsoap|Softsoap Sweet Honeysuckle & Orange Peel Bar Soap- 4 Pk
656|00830395031682|830395031682|Domo|Domo Mystery Minis Vinyl Figures
657|00072248266647|072248266647|International Collection|International Collection Walnut Oil
658|00041780001979|041780001979|Utz|Utz Jumbo Lunch Box Variety Pack - 22 Ct
659|00739510004047|739510004047|Sobe|Sobe Lifewater Kiwi Cherimoya
660|00672125015438|672125015438|Artskills|Artskills Neon Board - 2 Ct
661|00072368201412|072368201412|Delallo|Delallo Super Select Hot Cauliflower
662|00727806070074|727806070074|Dominex|Dominex Angelbowls Vegetable Bruschetta & Mozzarella
663|00707226719524|707226719524|Zak!|Zak Easy Grip Flatware Nickelodeon Teenage Mutant Ninja Turtles
664|00300450449078|300450449078|Tylenol|Tylenol Extra Strength Acetaminophen Pain Reliever - 50 Caplets
665|00073852026313|073852026313|Purell|Purell Advanced Hand Sanitizer Refreshing Gel  8 Oz. Plus 2 Oz. Free
666|00378112694807|378112694807|Chloraseptic|Chloraseptic Sore Throat Portable Spray Cherry
667|00013232750810|013232750810|Horizons|Prince Michel Horizons Merlot Wine
668|00075900007534|075900007534|Bob Evans|Bob Evans Everyday Classics Sausage & Cheese Sandwiches - 6 Ct
669|00819933010204|819933010204|Thicker Fuller Hair|Thicker Fuller Hair Instantly Thick Serum
670|00030000264423|030000264423|Quaker|Quaker Instant Oatmeal Bakery Favorites - Apple Crisp, Cinnamon Roll, Banana Bread Flavor Packets
671|00089156801129|089156801129|Santa Barbara Olive Co.|Santa Barbara Olive Co. Pimento Martini Olives
672|00688267129148|688267129148|Ahold|Ahold Spearmint Starlights Hard Candy
673|00688267049439|688267049439|Nature's Promise|Nature's Promise Organics Organic Baby Arugula
674|00018000007578|018000007578|Pillsbury|Pillsbury Crescent Seamless Dough Sheet
675|00073420516208|073420516208|Daisy|Daisy Low Fat Cottage Cheese Small Curd 2% Milk Fat
676|00858328761185|858328761185|Wolfgang Puck|Wolfgang Puck Organgic Soup Hearty Lentil Vegetable
677|00072700000307|072700000307|Manischewitz|Manischewitz Passover Egg Matzo Crackers
678|00813715012684|813715012684|Batchelors|Batchelors Bigga Marrowfat Processed Peas
679|00038000845192|038000845192|Pringles|Pringles Multigrain Crisps Sour Cream & Onion
680|00814384000781|814384000781|Poochie|Poochie Naturals Dog Treats Steak Strips
681|00075371050183|075371050183|Baby Magic|Baby Magic Gentle Baby Lotion Soft Cotton Blooms
682|00655852001691|655852001691|Aurora Natural|Aurora Natural Sunflower Seeds
683|00013000007023|013000007023|Heinz|Heinz Reduced Sugar Tomato Ketchup
684|00300054903921|300054903921|Centrum|Centrum Flavor Burst Wild Grape Multivitamin/multimineral Supplement Adult Chews - 120 Ct
685|00092227701105|092227701105|Burgers By Amylu|Burgers By Amylu Spinach & Cheddar Chicken Burgers With Caramelized Onions - 2 Ct
686|00045255115215|045255115215|Usda Produce|Onions Cipollini
687|00828545110127|828545110127|Fit|Fit Fruit & Vegetable Wash
688|00072248710027|072248710027|Amore|Paste Tmo Basil
689|00075209824948|075209824948|Mcconnell's|Mcconnell's Fine Ice Creams Vanilla Bean
690|00041520029638|041520029638|Companion|Companion Stainless Steel Bowl
691|00747599620010|747599620010|Ghirardelli|Ghirardelli Premium Hot Cocoa Double Chocolate
692|00012546685016|012546685016|Stride|Stride Id Sugar Free Gum Berrymelon - 14 Ct
693|00074200202106|074200202106|L'eggs|L'eggs Silken Mist Pantyhose Control Top Silky Sheer Leg B Jet Black
694|00073435003038|073435003038|King's Hawaiian|King's Hawaiian Hamburger Buns Original Hawaiian Sweet - 6 Ct
695|00048500021255|048500021255|Tropicana|Tropicana Juice Beverage Lemonade
696|00688267128769|688267128769|Ahold|Ahold Sharp Cheddar 2% Milk Finely Shredded
697|00817539011069|817539011069|Sneaky Pete's|Sneaky Pete's Oatstanding Beverage Mango Mystique
698|00041129080863|041129080863|Prince|Prince Pasta Portions Enriched Macaroni Product Curly Elbow Boil-in-bag - 3 Ct
699|00070907026250|070907026250|Lifestyles|Lifestyles Pleasure Collection Premium Lubricated Condoms - 30 Ct
700|00043000045763|043000045763|Jell-o|Jell-o Gelatin Snacks Raspberry - 4 Ct
701|00817855010494|817855010494|K-9 Cookhouse|K-9 Cookhouse 10-inch Duck Wrapped Retriever
702|00637480055055|637480055055|Atkins|Atkins Day Break Cinnamon Bun Bar - 5 Ct
703|00022506131019|022506131019|Spectrum Essentials|Spectrum Essentials Organic Flax Oil Omega-3 Ultralignan With Vitamin D
704|00856382003043|856382003043|Bantry Bay Premium Seafoods|Bantry Bay Premium Seafoods Seafood Paella
705|00352800482525|352800482525|Lubriderm|Lubriderm Moisturizer With Sunscreen Advanced Therapy Lotion
706|00074682117448|074682117448|Natural Brew|Natural Brew Draft Root Beer - 4 Ct
707|00070200520554|070200520554|Marzetti|Marzetti All Natural Salad Dressing Asiago Peppercorn
708|00071429002463|071429002463|Zatarain's|Zatarain's Alfredo Blackened Chicken New Orleans Style
709|00075072001095|075072001095|Cosmo's|Cosmo's Hot Stuffed Peppers
710|00037000875468|037000875468|Tide +|Tide + Bleach Alternative Original
711|00021888410118|021888410118|Rainbow Light|Rainbow Light Protein Engergizer Chocolate
712|00789622909983|789622909983|Heartland Meadow|Heartland Meadow Natural Angus Beef Ribeye Steak
713|00041457513491|041457513491|Goody|Goody Comb With Control Easy Hold Detangling Comb
714|00688267133671|688267133671|Ahold|Ahold Soup Gazpacho
715|00019063232341|019063232341|Fruit2o|Fruit2o Flavored Water Beverage Natural Strawberry - 6 Ct
716|00052000134742|052000134742|Propel|Propel Zero Water Beverage Nutrient Enhanced Zero Calorie Mandarin Orange - 6 Pk
717|00076840101283|076840101283|Ben & Jerry's|Ben & Jerry's Ice Cream Cheesecake Brownie
718|00074682107890|074682107890|R.w. Knudsen|R.w. Knudsen Juice Just Black Currant
719|00041755008002|041755008002|Langers|Langers Cranberry Plus 100% Juice
720|00755355150022|755355150022|Harmonies|Harmonies Whole Grain Chips Cinnamon Toast
721|00041520887801|041520887801|S&s Brands, Inc.|Pumpkin Plastic Bucket
722|00603084230648|603084230648|Garnier|Garnier Fructis Fortifying Color Shield Shampoo For Color-treated Hair
723|00071662112059|071662112059|Crayola|Crayola Kids' Paint Washable Classic Colors - 10 Ct
724|00077245102530|077245102530|Elite|Elite Instant 100% Pure Coffee
725|00017000068091|017000068091|Right Guard|Right Guard Total Defense 5 Power Gel Arctic Refresh Deodorant
726|00074312134395|074312134395|Nature's Bounty|Nature's Bounty Calcium Plus Vitamin D3 Mineral Supplement Softgels
727|00070074564777|070074564777|Ensure|Ensure Muscle Health Revigor Homemade Vanilla Shake - 4 Pk
728|00087052777739|087052777739|Clearly Natural|Clearly Natural Essentials Glycerine Hand Soap Vitamin E
729|00214824900006|214824900006|Usda Meat|Bone-in French Cut Pork Rib Roast
730|00031600666167|031600666167|Kiwi|Kiwi 54'' Sport Laces Flat Black - 1 Ct
731|00732913440740|732913440740|Seventh Generation|Seventh Generation Foaming Baby Shampoo & Wash
732|00688267092534|688267092534|Ahold|Ahold Meat Lasagna Family Size
733|00044000012519|044000012519|Oreo|Oreo Handi-snacks Packs Cookie Sticks 'n Creme Dip - 6 Pk
734|00858596001600|858596001600|My Boy's Baking|My Boy's Baking Biscotti Chocolate Chip Toffee Pecan
735|00027154313381|027154313381|Campechanas|Cuetara Campechanas Palmeritas Crisp Palm Leaf Cookies
736|00077975099896|077975099896|Snyder's Of Hanover|Snyder's Of Hanover Pretzel Dips Hershey's Milk Chocolate
737|00022000012982|022000012982|Starburst|Starburst Crazy Beans
738|00044500976489|044500976489|Hillshire Farm|Hillshire Farm Deli Select Honey Ham With Water Added Ultra Thin
739|00051111025949|051111025949|Scotch|Scotch Super Glue Liquid Fine Tip - 2 Ct
740|00757645018500|757645018500|Newman's Own Organics|Newman's Own Organics Licorice Twists Sour Apple
741|00041409002479|041409002479|Chiquita|Chiquita Banana Bread Mix
742|00046689800265|046689800265|New England Naturals|New England Naturals Antioxidant Organic Granola With Superfruit Berries And Vanilla
743|00688267124976|688267124976|Ahold|Ahold Light Vegetable & Rice Soup
744|00072477987054|072477987054|Citronella|Pic Citronella Plus Mosquito Repellent Diffuser
745|00071921025281|071921025281|Digiorno|Digiorno Garlic Bread Pizza Four Cheese
746|00021000042777|021000042777|Kraft|Kraft Recipe Makers Cooking Sauces Skillet Recipe Tex-mex Chicken Fajita
747|00016571950279|016571950279|Sparkling Ice|Sparkling Ice Lemonade Raspberry Lemonade
748|00704863312125|704863312125|Classic Cooking|Classic Cooking Spanish Rice Casserole
749|00879924000010|879924000010|Passage To India|Passage To India Simmer Sauce Korma Mild
750|00021000638994|021000638994|Kraft|Kraft Mexican Style Finely Shredded Four Cheese
751|00688267044977|688267044977|Giant|Giant Peach Iced Tea Sugar Free Drink Mix- 6 Ct
752|00688267086809|688267086809|Ahold|Ahold 2nd Stage Baby Food Apples - 2 Ct
753|00070650800763|070650800763|Taste Of Thai|Noodle Qck Meal Pad Thai
754|00065203809409|065203809409|Just Basic|Just Basic Headwraps - 6 Ct
755|00071840092036|071840092036|Marie's|Marie's Dressing & Dip With Real Premium Ingredients Chunky Blue Cheese
756|00077900650246|077900650246|Jimmy Dean|Jimmy Dean Delights Honey Wheat Flatbread Turkey Sausage, Egg & Cheese - 4 Ct
757|00041900073633|041900073633|Fruit Rush|Fruit Rush Fruit Drink Orange
758|00305730133203|305730133203|Advil|Advil Ibuprofen Tablets - 20 Ct
759|00075457129000|075457129000|Garelick Farms|Garelick Farms Dairy Pure Milk 1% Lowfat
760|00041457873557|041457873557|Goody|Goody Mini Series All Purpose Brush
761|00021000030453|021000030453|Breakstone's|Breakstone's 2% Milkfat Lowfat Cottage Cheese
762|00070922222019|070922222019|Airboss|Airboss One Drop All Purpose Household Deodorizer
763|00035000446244|035000446244|Ajax|Ajax Super Degreaser Lemon Dish Liquid
764|00850163004014|850163004014|American Farmer|American Farmer Skinny N'light Kettle Popped Corn
765|00070281000310|070281000310|Koops'|Koops' Mustard Original Yellow
766|00041548751290|041548751290|Edy's|Edy's Rich & Creamy Grand Ice Cream Nestle Butterfinger
767|00028000706128|028000706128|Nescafe|Nescafe Taster's Choice French Roast Instant Coffee - 6 Ct
768|00037000204442|037000204442|Secret|Secret Scent Expressions Va-va Vanilla Antiperspirant Deodorant
769|00325866105042|325866105042|Aleve|Aleve Pain Reliever/fever Reducer Caplets - 50 Ct
770|00787359175015|787359175015|Fresh Gourmet|Fresh Gourmet Crispy Onions Garlic Pepper
771|00041520893345|041520893345|Smart Living|"Smart Living 4.125"" X 9.5"" Security Envelopes - 36 Ct"
772|00028000547783|028000547783|Butterfinger|Nestle Butterfinger Pieces In Milk Chocolate Bar
773|00041490736130|041490736130|King|King Syrup Golden
774|00021000043309|021000043309|Kraft|Kraft Miracle Whip Dressing With Olive Oil
775|00341520311345|341520311345|Careone|Careone Acid Reducer Tablets Original Strength - 60 Ct
776|00381519050336|381519050336|Clairol|Clairol Nice 'n Easy 5g Medium Golden Brown Permanent Haircolor
777|00074312368196|074312368196|Good 'n Natural|Good 'n Natural Bar Peanut Butter
778|00022000116321|022000116321|Skittles|Skittles Blenders Bite Size Candies
779|00635992041405|635992041405|Genisoy|Genisoy Southern Style Chunky Peanut Butter Fudge Soy Protein Bar
780|00071249155486|071249155486|L'oreal Paris|L'oreal  Paris Hair Expertise Everpure Smooth Conditioner
781|00688267138966|688267138966|Simply Enjoy|Simply Enjoy Earl Grey Lavender Loose Organic Black Tea
782|00722648654086|722648654086|Superior|Superior Nut & Candy Yogurt Raisins
783|00049200902943|049200902943|Domino|Domino Sugar Pourable Light Brown
784|00078300098386|078300098386|Playtex|Playtex Gentle Glide 360 Degree Tampons Plastic Super  - 18ct
785|00071160063341|071160063341|Corningware|Corningware Etch Square Baker With Glass Lid Brick - 1.5 Qt
786|00070650007070|070650007070|Odense|Odense Almond Paste Coconut
787|00041387415940|041387415940|4c|4c Totally Light Sugar Free Energy Rush Strawberry Tea 2 Go Packets - 14 Ct
788|00083120103691|083120103691|Franzia|Franzia House Wine Favorites Sunset Blush
789|00039978001887|039978001887|Bob's Red Mill|Bob's Red Mill Granola Cinnamon Raisin
790|00025500002279|025500002279|Folgers|Folgers Classic Roast Ground Coffee Refill Pack Medium
791|00855930001494|855930001494|Aleia's|Aleia's Oatmeal Raisin Cookies Gluten Free
792|00762111206022|762111206022|Starbucks|Starbucks Whole Bean Coffee Dark Espresso Roast
793|00076840135554|076840135554|Ben & Jerry's|Ben & Jerry's Stephen Colbert's Americone Dream Ice Cream Vanilla
794|00049000053678|049000053678|Sprite|Sprite 12 Oz Lemon-lime Soda 30 Pk
795|00062338870700|062338870700|Air Wick|Air Wick Scented Reed Diffuser Lavender & Chamomile
796|00054800032341|054800032341|Uncle Ben's|Uncle Ben's Garden Vegetable Ready Rice
797|00016000275645|016000275645|Cheerios|General Mills Cheerios Cereal
798|00767335000821|767335000821|Dr. Mcdougall's|Dr. Mcdougall's Right Foods Lower Sodium Vegan Soup Chinese Noodle
799|00885131787835|885131787835|Gerber|Gerber Graduates Sip & Smile Soft Spout Spill-proof Cups
800|00042037102845|042037102845|Bc|Bc Aspirin Powder Arthritis Pain - 50 Ct
801|00023923206311|023923206311|Earth's Best|Earth's Best French Toast Sticks Homestyle - 32 Ct
802|00726528291484|726528291484|Hallmark|Hallmark Party Napkins Luncheon 2-ply Bastin Day Of Gratitude
803|00036000306149|036000306149|Huggies|Huggies Overnite Diapers Step 4 Big Pack 60
804|00300878693770|300878693770|Enfamil|Enfamil Gentlease Infant Formula For Fusiness, Gas & Crying Powder Pouches - 2 Ct
805|00036632032690|036632032690|Oikos|Dannon Oikos Vanilla Greek Nonfat Yogurt - 4 Ct
806|00077260097156|077260097156|Russell Stover|Russell Stover Assorted Fine Chocolates Individually Wrapped
807|00017145848404|017145848404|Campbell's|Campbell's Microwaveable Soup Container
808|00804066020046|804066020046|Hero|Hero Raspberry Fruit Spread
809|00024131135035|024131135035|Farberware|Farberware Barbeque Sauce Pan And Basting Brush
810|00214461700007|214461700007|Peapod|Certified Angus Beef Fully Cooked Prime Rib
811|00076991003122|076991003122|Mariani|Mariani All Natural Premium Blanched Slivered Almonds
812|00363824057187|363824057187|Mucinex|Mucinexd Expectorant & Nasal Decongestant 12 Hour - 18 Ct
813|00047800330142|047800330142|B&m|B&m Home Style Baked Beans
814|00012587785140|012587785140|Glad|Glad Designer Series Plastic Containers And Lids Medium Rectangle 3-cups - 4 Ct
815|00087692100140|087692100140|Samuel Adams|Samuel Adams Boston Lager - 12 Ct
816|00870223024370|870223024370|Salon Selectives|Salon Selectives Smooths & Shines Color Safe Shampoo
817|00033674130001|033674130001|Nature's Way|Nature's Way Garlic Bulb 580mg Capsules - 100 Ct
818|00075900002591|075900002591|Bob Evans|Bob Evans Pork Sausage Links Original - 24 Ct
819|02086760000007|086760000007|Usda Seafood|Pei Mussels Farm Raised
820|00380040476004|380040476004|Tena|Tena Serenity Heavy Absorbency Long Pads - 42 Ct
821|00688267068751|688267068751|Guaranteed Value|Guaranteed Value Garlic Powder
822|00099477100030|099477100030|Viva|Fun Treats Viva Ice Pops
823|00018627703440|018627703440|Kashi|Kashi Indigo Morning Cereal
824|00036000258455|036000258455|Kleenex|Kleenex Brand Tissue Sneeze Shield - 3 Pk
825|00075609601477|075609601477|Olay|Olay Regenerist Regenerating Cream Cleanser Skin Care 5 Fl Oz
826|00044000027056|044000027056|Oreo|Nabisco Golden Oreo Cakesters Soft Snack Cakes - 14 Ct
827|00078729120408|078729120408|Vidal Sassoon|Vidal Sassoon No-metal Peace Sign/plain Elastics - 15 Ct
828|00306960208136|306960208136|Boiron|Boiron Cimicifuga Racemosa 30 C - 80 Ct
829|00019200003124|019200003124|Lysol|Lysol No-touch Sparkling Shimmering Berry Scent Antibacterial Hand Soap Refill
830|00688267147081|688267147081|Ahold|Ahold Dark Chocolate Cranberries
831|00076660004658|076660004658|Fixodent|Fixodent Complete Fresh Mint Denture Adhesive Cream 2.4 Oz
832|00028400039130|028400039130|Cheetos|Cheetos Cheese Snacks Crunchy
833|00036000412482|036000412482|Huggies|Huggies Pull-ups Learning Designs Training Pants 2t-3t 18-34lbs - 52 Ct
834|00021000024643|021000024643|Kraft|Kraft Mozzarella 2% Milk Cheese Shredded
835|00055653670506|055653670506|Dare|Cracker Vivant
836|00028400006903|028400006903|Sunchips|Sun Chips 6 Grain Medley Creamy Roasted Garlic Chips
837|00097421376791|097421376791|Powerbar|Powerbar 20g Protein Plus Bar Vanilla
838|00039438236729|039438236729|Mello Smello|Mello Smello Magnet Valentines Guitar Cards & Magnets - 16 Ct
839|00041780005120|041780005120|Utz|Utz Dips Ranch
840|00789785500133|789785500133|Skinny Cow|Skinny Cow Ice Cream Cones Vanilla Caramel - 4 Ct
841|00044700072776|044700072776|Oscar Mayer|Oscar Mayer Deli Fresh Cajun Style Turkey Breast
842|00688267097027|688267097027|Ahold|Ahold Italian Bread
843|00736393510078|736393510078|Glory Foods|Glory Foods Seasoned Southern Style Purple Hull Peas
844|00086600750750|086600750750|Bumble Bee|Bumble Bee Sardines In Mustard
845|00033674123003|033674123003|Nature's Way|Nature's Way Dandelion Root 525mg - 100 Ct
846|00898406001819|898406001819|Powell & Mahoney|Powell & Mahoney Cocktail Mixer Blood Orange
847|00076840081332|076840081332|Ben & Jerry's|Ben & Jerry's All Natural Vermont's Finest Peanut Brittle Ice Cream
848|00053600000789|053600000789|La Yogurt|La Yogurt Probiotic Rich & Creamy Low Fat Yogurt Mango
849|00077260000064|077260000064|Russell Stover|Russell Stover Assorted Chocolates
850|00035000766519|035000766519|Colgate|Colgate Optic White Dual Action Crystal Mint Toothpaste
851|00208220300003|208220300003|Usda Meat|Pork Back Ribs Country Style Bone-in
852|00020716200000|020716200000|Usda Meat|Pork Back Ribs Country Style Bone-in
853|00688267139420|688267139420|Ahold|Ahold Pizza Dough - 2 Ct
854|00051381911072|051381911072|Aura Cacia|Aura Cacia Camphor (white)
855|00037600234788|037600234788|Skippy|Skippy Natural Singles Peanut Butter Spread Creamy - 6 Ct
856|00718334337432|718334337432|Desert Essence|Desert Essence Coconut Hand And Body Lotion
857|00041322356420|041322356420|Farm Rich|Farm Rich Mozzarella Sticks
858|00011313070703|011313070703|Fantasia|Fantasia Argan Oil Curl Styling Pudding
859|00072368201726|072368201726|Delallo|Delallo Super Select Hot Sliced Jalapenos
860|00041520892706|041520892706|Companion|Companion Hamster & Gerbil Food
861|00669125608005|669125608005|Nutri-vet|Nutri-vet Skin And Coat Health Care Wild Alaskan Salmon Oil For Dogs
862|00736393501434|736393501434|Glory Foods|Glory Foods Sensibly Seasoned Blackeye Peas Lower Sodium
863|00028989717504|028989717504|Morningstar|Morning Star Farms Veggie Burgers Spicy Black Bean- 8 Ct
864|00017000080758|017000080758|Dial|Dial Island Mango Hand Sanitizer
865|00078729113899|078729113899|Vidal Sassoon|Vidal Sassoon Sure Grip Clix Animal Print - 6 Ct
866|00341520313110|341520313110|Careone|Careone Hydrogen Peroxide Solution
867|00688267033315|688267033315|Ahold|Ahold Veggietales Fruit Flavored Snacks Assorted - 6 Ct
868|00655852000267|655852000267|Aurora Natural|Aurora Natural Granola Vanilla Crunch
869|00781963020679|781963020679|Berkley Green|Berkley Green  Multi-surface Cleaner Free & Clear
870|00075020016829|075020016829|Philips|Philips Avent Pacifier - 0-6m
871|00015000004316|015000004316|Gerber|Gerber 2nd Foods Applesauce
872|00051000130624|051000130624|V8|V8 Splash Fruit Medley Juice
873|00075072001088|075072001088|Cosmo's|Cosmo's Hot Cherry Peppers
874|00027917001128|027917001128|Nutrition Now|Nutrition Now Pb 8 Pro-biotic Acidophilus For Life - 120 Capsules
875|00037000867517|037000867517|Gain|Gain Flings! 3 In 1 Detergent+oxi Boost+febreze Moonlight Breeze - 16 Ct
876|00062338870687|062338870687|Air Wick|Air Wick Scented Reed Diffuser Warm Apple Pie
877|00076001010096|076001010096|Candle-lite|Candle-lite 12 In Candle Crimson
878|00077900491603|077900491603|Jimmy Dean|Jimmy Dean Skillets Sausage
879|00637480077057|637480077057|Atkins|Atkins Endulge Peanut Butter Cups - 5 Pk
880|00076479636163|076479636163|Giuliano|Giuliano Olive Antipasto Italian Style
881|00688267046711|688267046711|Guaranteed Value|Guaranteed Value Apple Juice Cocktail
882|00674336978816|674336978816|Ahold|Spray Mums Assorted
883|00051131972902|051131972902|Post-it|Post-it Flags - 60 Ct
884|00041520035493|041520035493|Careone|Careone Moisturizing Body Wash La La Lavender
885|00031000670009|031000670009|P.f. Chang's|P.f. Chang's Home Menu Meal For 2 Shanghai Style Beef
886|00033049000229|033049000229|Martin's|Martin's Kettle-cook'd Hand Cooked Potato Chips
887|00070982013428|070982013428|Evercare|Evercare Giant Lint Roller - 60 Ct
888|00732913228287|732913228287|Seventh Generation|Seventh Generation Natural Laundry Detergent Geranium Blossoms & Vanilla
889|00300450449092|300450449092|Tylenol|Tylenol Extra Strength Acetaminophen - 100 Caplets
890|00070200510081|070200510081|Marzetti|Marzetti Dressing Poppyseed Light
891|00021000701476|021000701476|Kraft|Kraft Anything Dressing Zesty Italian Lite
892|00052100634760|052100634760|Mccormick|Mccormick Grill Mates Chicken Rub
893|00074182280338|074182280338|Softsoap|Softsoap Body Butter Coconut Scrub Body Buff Wash
