894|00051500552186|051500552186|Pillsbury|Pillsbury Halloween Funfetti Premium Brownie Mix 13 X 9 Pan Size
895|00674336978533|674336978533|Ahold|Carnations Mini Assorted
896|00023100335827|023100335827|Cesar|Cesar Sunrise Smoked Bacon & Egg Canine Cuisine
897|00052100156507|052100156507|Cake Mate|Cake Mate Numeral 7 Birthday Candle
898|00070734523922|070734523922|Enerji|Enerji Green Tea Energy Shot Berry - 12 Ct
899|00071160073876|071160073876|Pyrex|Pyrex No-leak Lids Multi Pack - 6 Ct
900|00076239420803|076239420803|Mama Rosie's|Mama Rosie's Round Cheese Ravioli - 80 Ct
901|00015700052013|015700052013|Swiss Miss|Swiss Miss Classics Rich Chocolate Hot Cocoa Mix - 10 Ct
902|00016300166353|016300166353|Florida's Natural|Florida's Natural Orange Mango Juice
903|00036000406702|036000406702|Huggies|Huggies Snug & Dry Disney Baby Stage 5 Diapers (over 27 Lb) - 24 Ct
904|00070530671773|070530671773|Uni-ball|Uni-ball Vision Elite Blx Pen Blue/black
905|00071160010765|071160010765|Pyrex|Pyrex 4 Cup Glass Measuring Cup
906|00076301240124|076301240124|Apple & Eve|Apple & Eve Fruitables Tropical Orange Fruit & Vegetable Juice Beverage - 8 Pk
907|00080793808977|080793808977|Fuze|Fuze Diet Lemon Iced Tea 20 Fl Oz
908|00020735112076|020735112076|Turkey Hill|Turkey Hill All Natural Recipe Vanilla Bean, Chocolate, & Butter Almond Philadelphia Style Ice Cream
909|00070501297834|070501297834|Neutrogena|Neutrogena Naturals Purifying Cream Cleanser
910|00052200095744|052200095744|Beech-nut|Beech Nut Stage 2 1/2 Homestyle Textures - 16 Ct
911|00037466066837|037466066837|Lindt|Lindt Excellence Strawberry Dark Chocolate
912|00022600296164|022600296164|Nair|Nair Brazilian Spa Clay Total Care Face Trio
913|00072489010016|072489010016|Penn|Penn Championship Extra-duty Felt Tennis Balls - 3 Ct
914|00052200007747|052200007747|Beech-nut|Beech Nut Homestyle Goodies Stage 4 Popped Rice Snack Vanilla Cream - 5 Ct
915|00079441002225|079441002225|Van Ness|Van Ness Eco Pet Bowl 8 Oz
916|00217418200001|217418200001|Usda Meat|Porterhouse Steak
917|00028873000000|028873000000|Usda Meat|Porterhouse Steak
918|00072180639790|072180639790|Freschetta|Freschetta Naturally Rising Crust Pizza Signature Pepperoni
919|00616029060026|616029060026|Oberweis|Oberweis Dairy Ice Cream Pie Peppermint
920|00212581800003|212581800003|Maple Leaf Farms|Maple Leaf Farms Duck With Orange Sauce Packet
921|00071537020250|071537020250|Polar|Polar Calorie-free Seltzer Ruby Red Grapefruit
922|00688267144424|688267144424|Ahold|Ahold Dry Roasted Peanuts With Sea Salt
923|00074030000040|074030000040|Sorrento|Sorrento Cheese Mozzarella
924|00636874090214|636874090214|Eo Products|Eo Products Volumizing Conditioner Rosemary And Mint - 8 Fl Oz
925|00688267142024|688267142024|Ahold|Ahold Tuna Salad
926|00052000134483|052000134483|Gatorade|Gatorade G Series 01 Prime Cool Blue Energy Chews - 6 Ct
927|00857003002001|857003002001|Maia|Maia Inspired Nutrition Non-fat Greek Yogurt Vanilla Bean
928|00310742109092|310742109092|Rohto|Rohto Arctic Redness Relief Lubricant Eye Drops
929|00070048778193|070048778193|Goo Gone|Goo Gone Spray Gel
930|00850150002054|850150002054|Chocolates On Broadway|Chocolates On Broadway Milk Chocolate Peanut Butter Melt-a-way
931|00305730175111|305730175111|Advil|Advil Junior Strength Ibuprofen Coated Tablets 100mg - 24 Ct
932|00068437389716|068437389716|Brookside|Brookside Dark Chocolate Acai With Blueberry
933|00051500006863|051500006863|Smucker's|Smucker's Strawberry Preserves
934|00025700003915|025700003915|Ziploc|Ziploc Smart Zip Sandwich Bags - 100 Ct
935|00070575040268|070575040268|On-cor|On-cor Macaroni & Cheese
936|00021000024896|021000024896|Kraft|Kraft Singles Skim Milk American Cheese Slices - 16 Ct
937|00030100599548|030100599548|Keebler|Keebler Town House Flatbread Crisps Roasted Garlic
938|00786162002891|786162002891|Vitaminwater|Glaceau Vitamin Water Spark Grape-blueberry Nutrient Enhanced Water Beverage
939|00041262284296|041262284296|Wise|Wise Potato Chips Honey Bbq Flavored
940|00186905000021|186905000021|Lefty's Spices|Lefty's Spices Bbq Sauce Mild
941|00027393007621|027393007621|Glenny's|Glenny's Classic Fruit & Nut Whole Fruit & Nut Bars - 5 Ct
942|00072392138623|072392138623|Wyler's Light|Wyler's Light Water Enhancer Mixed Berry
943|00070257600018|070257600018|Scripto|Scripto Aim 'n Flame Ii Wind Resistant Lighter
944|00715826101908|715826101908|Ravens Wood|Ravens Wood Zinfandel Vinters Blend California 2010
945|00079200158866|079200158866|Wonka Sweetarts|Wonka Sweetarts Tangy Candy
946|00041000009952|041000009952|Lipton|Lipton Pureleaf All Natural Raspberry Iced Tea
947|00046100008232|046100008232|Sargento|Sargento Snacks Colby-jack Cheese Sticks Fridge Pack - 18 Ct
948|00040000029373|040000029373|M&m's|M&m's Minis Milk Chocolate Candies
949|00041100081810|041100081810|Coppertone|Coppertone Tanning Lotion Sunscreen Spf 8
950|00637118103370|637118103370|Brite Concepts|Brite Concepts Stainless Steel Washing Machine Lint Traps - 3 Ct
951|00053568214549|053568214549|Maynards|Maynards Bassett's Liquorice Allsorts Candy
952|00688267126277|688267126277|Ahold|Ahold  Infant Formula With Iron Advantage
953|00012844098150|012844098150|Refresh Your Car!|Refresh Your Car! Odor Eliminating Scented Oil Wick Cucumber Melon
954|00083900005764|083900005764|Gold Peak|Gold Peak Diet Iced Tea
955|00070470459127|070470459127|Yoplait|Yoplait Greek Blended Fat Free Yogurt Pineapple
956|00077817107000|077817107000|Bachman|Bachman Brick Oven Flame-baked Original Butter Twist Pretzels
957|00688267041211|688267041211|Ahold|Ahold Dried Cranberries
958|00019200882095|019200882095|Lysol|Lysol Automatic Toilet Bowl Cleaner With Bleach Lime Scent - 2 Ct
959|00033400612870|033400612870|San Giorgio|San Giorgio Enriched Macaroni Product Pot Pie Bows
960|00070670007388|070670007388|Davinci|Davinci Spinach Nests 100% Duram Wheat Semolina Macaroni
961|00051000192806|051000192806|V8|V8 V-fusion Vegetable And Fruit Juice Concord Grape Raspberry - 6 Ct
962|00688267087042|688267087042|Ahold|Ahold Small Red Beans
963|00016000437098|016000437098|Chicken Helper|Chicken Helper Ultimate Cheddar Broccoli
964|00050000429349|050000429349|Fancy Feast|Purina Fancy Feast Seafood Feast Classic Gourmet Cat Food
965|00017400105372|017400105372|Carolina|Carolina Rice Brown Rice Whole Grain
966|00045425680161|045425680161|Dockside Classics|Dockside Classics Pretzel Coated Crab Bites
967|00075720377466|075720377466|Poland Spring|Poland Spring Nature's Blends Spring Water & Real Juice Acai-grape
968|00012000004520|012000004520|Starbucks|Starbucks Frappuccino Mocha Chilled Coffee Drink
969|00851267000360|851267000360|Clean + Green|Clean + Green Natural Cleaner Carpet
970|00603084246458|603084246458|Garnier Nutritioniste|Garnier Nutritioniste Ultra-lift Anti-wrinkle Firming Night Cream
971|00071691394044|071691394044|Rubbermaid|Rubbermaid Premier Easy Find Lids - 3 Cups
972|00363824192208|363824192208|Mucinex|Mucinex Fast-max Multi-symptom Severe Congestion & Cold Caplets Maximum Strength - 20 Ct
973|00818158012192|818158012192|Kretschmer|Kretschmer Wheat Germ Original Toasted
974|00077975087565|077975087565|Snyder's Of Hanover|Snyder's Of Hanover Mini Pretzels
975|00025600004807|025600004807|Tastykake|Tastykake Sensables Sugar Free Chocolate Chocolate Chip Cookie Bars - 6 Ct
976|00719042700006|719042700006|Usda Produce|Tomatoes Heirloom
977|00083120102090|083120102090|Franzia|Franzia Vintner Select Chardonnay
978|00858078003085|858078003085|Cooksimple|Cooksimple Skillet Lasagna Mix With Brown Rice Pasta
979|00852311004037|852311004037|Bai 5|Bai 5 Antioxidant Infusions Beverage Ipanema Pomegranate
980|00718624400006|718624400006|The Buffalo Guys|The Buffalo Guys All Natural Buffalo Filet Of Sirloin
981|00081492693802|081492693802|Interdesign|Interdesign Over The Tank Roll Reserve!
982|00688267037665|688267037665|Ahold|Ahold Butterscotch Buttons Hard Candy
983|00280825000007|280825000007|Perdue|Perdue Fresh Chicken Leg Quarters
984|01011195340184|011195340184|Wisconian|Wisconian Delectables Veggie Dill Chips
985|00850803002042|850803002042|Therapearl|Therapearl Neck Wrap Hot & Cold Therapy
986|00047400649125|047400649125|Gillette|Gillette Body For Men Razor Kit
987|00043000005606|043000005606|Crystal Light|Crystal Light Liquid Drink Mix Pomtini
988|00735882500798|735882500798|Designer Greetings|Designer Greetings Tissue Glitterwrap Light Green - 8 Sheets
989|00865766000042|865766000042|Arcadian|Arcadian Sushi Spicy Chicken Spring Roll - 2 Ct
990|00041449601236|041449601236|Red Lobster|Red Lobster Cheddar Bay Biscuit Mix
991|00041000002861|041000002861|Lipton|Liptontea Bags - 48 Ct
992|00074108772008|074108772008|Conair|Conair Velvet Touch Soft Touch Handle Dry, Style & Volumize Brush
993|00041118009707|041118009707|Ellio's|Ellio's Cheese Pizza
994|00852885003269|852885003269|Scrumptious Pantry|Scrumptious Pantry Tomato Catsup Smoky
995|00077975010198|077975010198|Snyder's Of Hanover|Synder's Of Hanover Nibblers Honey Mustard & Onion
996|00070275051212|070275051212|Whink|Whink Professional Strength Rust & Iron Stain Remover
997|00616112061497|616112061497|Wholly Guacamole|Wholly Guacamole Layered Dip Black Bean
998|00011509043184|011509043184|Just For Men|Just For Men Hair Color Application Kit Medium-dark Brown A-40
999|00011210000155|011210000155|Tabasco|Tabasco Pepper Sauce Original Flavor
1000|00024000015468|024000015468|Del Monte|Del Monte Blue Lake Green Beans French Style
