1|00035200264013|035200264013|Riceland|Riceland American Jazmine Rice
2|00011111065925|011111065925|Caress|Caress Velvet Bliss Ultra Silkening Beauty Bar - 6 Ct
3|00023923330139|023923330139|Earth's Best|Earth's Best Organic Fruit Yogurt Smoothie Mixed Berry
4|00208528800007|208528800007|Boar's Head|Boar's Head Sliced White American Cheese - 120 Ct
5|00759283100036|759283100036|Back To Nature|Back To Nature Gluten Free White Cheddar Rice Thin Crackers
6|00074170388732|074170388732|Sally Hansen|Sally Hansen Nail Color Magnetic 903 Silver Elements
7|00070177154004|070177154004|Twinings Of London|Twinings Of London Classics Lady Grey Tea - 20 Ct
8|00051600080015|051600080015|Lea & Perrins|Lea & Perrins Marinade In-a-bag Cracked Peppercorn
9|00019600923015|019600923015|Van De Kamp's|Van De Kamp's Fillets Beer Battered - 10 Ct
10|00688267141676|688267141676|Ahold|Ahold Cocoa Almonds
11|00657622604842|657622604842|Honest Tea|Honest Tea Peach White Tea
12|00074676640211|074676640211|Mueller|Mueller Sport Care Basic Support Level Medium Elastic Knee Support
13|00603084234561|603084234561|Garnier Nutritioniste|Garnier Nutritioniste Moisture Rescue Fresh Cleansing Foam
14|00041167300121|041167300121|Pamprin|Pamprin Maximum Strength Multi-symptom Menstrual Pain Relief
15|00079400847201|079400847201|Suave|Suave Naturals Moisturizing Body Wash Creamy Tropical Coconut
16|00792850014008|792850014008|Burt's Bees|Burt's Bees Daily Moisturizing Cream Sensitive
17|00088313590791|088313590791|Ducal|Ducal Refried Red Beans
18|00021200725340|021200725340|Scotch|Scotch Removable Clear Mounting Squares - 35 Ct
19|00041520035646|041520035646|Careone|Careone Family Comb Set - 8 Ct
20|00204040000000|204040000000|Usda Produce|Plums Black
21|00753950001954|753950001954|Doctor's Best|Doctor's Best Best Curcumin C3 Complex 1000mg Tablets - 120 Ct
22|00016000288829|016000288829|Betty Crocker|Betty Crocker Twin Pack Real Potatoes Scalloped 2 Pouches For 2 Meals - 2 Pk
23|00070670009658|070670009658|Reese|Reese Mandarin Oranges Segments In Light Syrup
24|00688267084225|688267084225|Smart Living|Smart Living Charcoal Lighter Fluid
25|00044100117428|044100117428|Hood|Hood Latte Iced Coffee Drink Vanilla Latte
26|00300436344045|300436344045|Triaminic|Triaminic Syrup Night Time Cold & Cough Grape 4oz
27|00024600017008|024600017008|Morton|Morton Kosher Salt Coarse
28|00719175900007|719175900007|Usda Produce|Guava
29|00013000001038|013000001038|Heinz|Heinz Tomato Ketchup - 2 Ct
30|00723503568678|723503568678|Petmate|Petmate Booda Bones Steak, Bacon & Chicken Flavors - 9 Ct
31|00652790100226|652790100226|Zhena's Gypsy Tea|Zhena's Gypsy Tea Herbal Red Tea Sachets Fire Light Chai - 22 Ct
32|00008500004528|008500004528|Barefoot|Barefoot Pinot Grigio  187
33|00071463060078|071463060078|The First Years|Tomy The First Years Gumdrop Orthodontic Pacifiers 6m+ - 2ct
34|00312546628694|312546628694|Halls|Halls Menthol Cough Suppresant/oral Anesthetic Drops Honey-lemon - 30 Ct
35|00033674100066|033674100066|Nature's Way|Nature's Way Forskohlii - 60 Ct
36|00610358991525|610358991525|Deerfields Gluten Free|Rice Bran Gluten Free Dinner Rolls Plain
37|00073575295003|073575295003|Nakano|Nakano Seasoned Rice Vinegar Original
38|00030768540548|030768540548|Sundown Naturals|Sundown Naturals Essential Electrolytes Tropical Punch, Watermelon And Fruit Punch Gummies - 60 Ct
39|00028400029254|028400029254|Munchies|Munchies Sandwich Crackers Cheddar Cheese On Golden Toast Crackers - 8 Pk
40|00042272008063|042272008063|Amy's|Amy's Light & Lean Spaghetti Italiano
41|00031000670016|031000670016|P.f. Chang's|P.f. Chang's Home Menu Meal For Two Beef With Broccoli
42|00883978129115|883978129115|Mom's Best Naturals|Mom's Best Naturals Cereal Toasted Cinnamon Squares
43|00071403000379|071403000379|Ferrara|Ferrara Vanilla Syrup
44|00026000001403|026000001403|Elmer's|Elmer's Board Mate Dual Tip Glue Pen
45|00038000542237|038000542237|Kellogg's|Kellogg's Disney Pixar Cars 2 Cereal
46|00035457770664|035457770664|Mama Marys|Pizza Sauce
47|00884623708976|884623708976|Bear Naked|Bear Naked Fit Almond Crisp 100% Natural Energy Cereal
48|00079400271631|079400271631|Dove|Dove Men + Care Antiperspirant Deodorant Cool Silver
49|00062338879772|062338879772|Easy-off|Easy-off Oven Cleaner Lemon Scent
50|00047445919221|047445919221|Choice|Choice Organic Teas Black Tea Classic Black - 16 Ct
51|00041520314307|041520314307|Careone|Careone Lubricating Jelly
52|00015229375198|015229375198|Sacla|Sacla Italia Sun Dried Pesto Sauce
53|00036000141870|036000141870|Huggies|Huggies Natural Care Wipes - 3 Pk
54|00789293900173|789293900173|Serpis|Serpis Green Olives Stuffed With Spicy Chorizo
55|00817544011047|817544011047|Ripken|Ripken Power Shred Beef Jerky Teriyaki
56|00073410032022|073410032022|Arnold|Arnold Bread Jewish Rye Everything
57|00032917001863|032917001863|Traditional Medicinals|Traditional Medicinals Herbal Tea Bags Just For Kids Organic Nighty Night - 18 Ct
58|00075767200246|075767200246|Perry's Ice Cream|Perry's Ice Cream Panda Paws
59|00008500001210|008500001210|Black Swan|Black Swan Shiraz Merlot 1.5
60|00899874002018|899874002018|Maty's|Maty's All Natural Kids 1+ Caramel Banana Taste Cough Syrup
61|00021000028207|021000028207|Kraft|Kraft Anything Dressing Honey Mustard
62|00011141100054|011141100054|Eight O'clock Coffee|Eight O'clock Coffee Dark Italian Roast Ground
63|00688267038693|688267038693|Ahold|Ahold  Honey Mustard
64|00763948042937|763948042937|Enzymatic Therapy|Enzymatic Therapy  Acidophilus Pearls Active Cultures Dietary Supplement - 30 Ct
65|00688267078491|688267078491|Ahold|Ahold Complete Buttermilk Pancake & Waffle Mix
66|00041235000700|041235000700|Mrs Renfro|Salsa Habanero
67|00804879349471|804879349471|Say-it|Say-it Sandwich & Snack Bags- 60 Pk
68|00044500976496|044500976496|Hillshire Farm|Hillshire Farm Deli Select Smoked Ham With Water Added Ultra Thin
69|00050000127344|050000127344|Coffee-mate|Nestle Coffee-mate Fat Free Hazelnut Flavor Coffee Creamer
70|00041520313539|041520313539|Careone|Careone Cotton Swabs
71|00380045410010|380045410010|1-day|1-day Vaginal Antifungal Prefilled Applicator 1-dose Treatment
72|00305732871103|305732871103|Preparation H|Preparation H Hemorrhoidal Ointment
73|00736547211561|736547211561|Roth Kase|Roth Kase Mini Cheeseboard Kit Havarti, Gruyere & Pepper Jack - 3 Ct
74|00731919138200|731919138200|Firm Grip|Firm Grip Disposable Nitrile Gloves - 10 Gloves
75|00037000835080|037000835080|Downy|Downy Ultra Infusions Orchid Allure Fabric Softener - 48 Loads
76|00888109110154|888109110154|Hostess|Hostess Mini Muffins Chocolate Chip - 20 Ct
77|00015000005771|015000005771|Gerber|Gerber Graduates For Toddlers Lil' Meals Pasta Shells & Cheese
78|00097421490015|097421490015|Powerbar|Powerbar Protein Plus High Protein Bar Vanilla Yogurt
79|00878639000476|878639000476|Every Man Jack|Every Man Jack Shave Cream
80|00688267130434|688267130434|Ahold|Ahold Premium Paper Towels Giant Rolls - 8 Ct
81|00637876989551|637876989551|Piacci|Piacci Parmesan Nuggets
82|00022796910028|022796910028|Organix|Organix Smoothing Shea Butter Conditioner
83|00011017405269|011017405269|Dr Scholl's|Dr. Scholl's For Her Rub Relief Strips
84|00022451017505|022451017505|Guida's|Guida's Whole Milk
85|00011152817606|011152817606|Hime|Hime Wasabi Powdered Sushi
86|00216076400006|216076400006|Usda Meat|Boneless Pork Shoulder Roast
87|00020822530000|020822530000|Usda Meat|Boneless Pork Shoulder Roast
88|00688267136474|688267136474|Simply Enjoy|Ahold Simply Enjoy Gourmet Spread Smoky Fig & Roasted Garlic
89|00086279036858|086279036858|Cuisinart|Cuisinart Citrus Juicer Pulp Control
90|00021000611614|021000611614|Velveeta|Velveeta Cheese
91|00311017235256|311017235256|Lotrimin|Lotrimin Ultra Antifungal Athlete's Foot Cream
92|00047325077355|047325077355|Pasta Lensi|Pasta Lensi Gigli #253
93|00182308000040|182308000040|Cherrybrook Kitchen|Cherrybrook Kitchen D.w. Sugar Cookie Mix
94|00090800000751|090800000751|Herb Pharm|Herb Pharm Black Elderberry Herbal Glycerite Extract
95|00041167023044|041167023044|Gold Bond|Gold Bond Medicated Cornstarch Plus Baby Powder
96|00016000164901|016000164901|Chex Mix|General Mills Sweet 'n Salty Honey Nut Chex Mix
97|00698997807308|698997807308|Udi's|Udi's Soft N' Chewy Granola Bars Chocolate Chip - 5 Ct
98|00162308001773|162308001773|Usda Meat|Smoked Pork Hocks - 4 Ct
99|00857320002081|857320002081|Kelapo|Kelapo Extra Virgin Coconut Oil Baking Sticks
100|00041443902643|041443902643|Margaret Holmes|Margaret Holmes Peanut Patch Green Boiled Peanuts Hot & Spicy
101|00021000023233|021000023233|Kraft|Kraft Velveeta Shells & Cheese 2% Milk
102|00046135116742|046135116742|Sylvania|Sylvania Daylight 75 Watt Indoor Light Bulb
103|00047834063047|047834063047|Sushi Chef|Sushi Chef Wakame Soup Mix Traditional Japanese Style
104|00051000143709|051000143709|Campbell's|Campbell's Homestyle Soup Italian-style Wedding
105|00025537999054|025537999054|Sapore Sensuale|Sapore Sensuale Cake Toasted Almond
106|00041457272565|041457272565|Goody|Goody Ouchless No Metal Elastics - 29 Ct
107|00688267123580|688267123580|Ahold|Ahold Cooked Shrimp Large Tail-on
108|00041520893307|041520893307|Smart Living|"Smart Living 10.5"" X 8"" 3 Subject Notebook College Ruled"
109|00078300098362|078300098362|Playtex|Playtex Plastic Tampons Gentle Glide 360 Multi-pack Regular/super Fresh Scent - 18 Ct
110|00034000003662|034000003662|Hershey's|Hershey's Caramel Syrup
111|00019800702328|019800702328|Windex|Windex Original Glass & Surface Wipes - 28 Pk
112|00075609190360|075609190360|Olay Total Effects|Olay Total Effects 7-in-1 Tone Correcting Eye Treatment 0.5 Fl Oz
113|00816559011080|816559011080|Alberto Vo5|Alberto Vo5 Normal Balancing Shampoo
114|00717489901055|717489901055|Milani|Milani Total Lash Cover Mascara 105 Black
115|00608623000331|608623000331|Sylvia's Restaurant|Sylvia's Restaurant Specially-seasoned Field Peas With Snaps
116|00044000030384|044000030384|Wheat Thins|Nabisco Wheat Thins Snacks
117|00041520019677|041520019677|Careone|Careone Whitening Toothbrush Soft
118|00305210269583|305210269583|Vaseline|Vaseline Spray & Go Moisturizer Total Moisture
119|00031604027551|031604027551|Nature Made|Nature Made Fish Oil 1200mg Omega-3 360mg Liquid Softgels Lemon Flavor - 60 Ct
120|00853553002133|853553002133|Bellucci|Belluci Extra Virgin Olive Oil 100% Italian
121|00028400033329|028400033329|Ruffles|Ruffles Sour Cream & Onion Potato Chips
122|00020735420966|020735420966|Turkey Hill|Turkey Hill Premium Ice Cream Party Cake
123|00307667630039|307667630039|Tums|Tums Freshers Antacid Spearmint - 2 Pk
124|00072700104272|072700104272|Manischewitz|Manishchewitz Gluten Free Wide Egg Noodles
125|00047400302877|047400302877|Gillette Fusion|Gillette Fusion Proglide Cartridges - 8 Ct
126|00296680000007|296680000007|Bakery|Bakery Pistachio Muffin - 4 Ct
127|00041716842942|041716842942|Frigo|Frigo Cheese Heads 100% Natural String Cheese Light - 12 Ct
128|00070074586137|070074586137|Similac Advance|Similac Advance Infant Formula With Iron Milk-based/ready To Feed - 6 Ct
129|00015300430617|015300430617|Rice-a-roni|Rice A Roni Chicken Flavor Lower Sodium Rice
130|00616029012407|616029012407|Oberweis|Oberweis Dairy Raspberry Lemonade
131|00688267139680|688267139680|Companion|Companion Dog Biscuits Senior
132|00641748624792|641748624792|Coco|Coco Lite Multigrain Pop Cakes Whole Wheat
133|00050000301522|050000301522|Coffee-mate|Nestle The Original Coffee Mate
134|00716123124638|716123124638|Sweet Leaf|Sweetleaf Natural Stevia Sweetener Packets - 70 Ct
135|00093709300403|093709300403|Pamela's|Pamela's Chocolate Cake Mix
136|00098016322834|098016322834|Designer Greetings|Designer Gift Bag Glitterwrap
137|00688267136252|688267136252|Ahold|Ahold 5 Cheese Pizza Ready To Bake
138|00610358991822|610358991822|Deerfields Gluten Free|Rice Bran Gluten Free Mini Baguette
139|00028400162234|028400162234|Cracker Jack|Cracker Jack Popcorn Butter Toffee
140|00074711545679|074711545679|Swingline|Swingline Standard Desk Stapler Bonus Pack!
141|00208220500007|208220500007|Usda Meat|Pork Chops Bone-in Center Cut
142|00028881400000|028881400000|Usda Meat|Pork Chops Bone-in Center Cut
143|00027000419021|027000419021|Snack Pack|Snack Pack Tapioca Pudding - 4 Pk
144|00041520880710|041520880710|Pure Power|Pure Power Easy Grip Scrub Brush
145|00744160220198|744160220198|Cocktail|Cocktail Rx Frozen Cocktails Blue Hawaiian
146|00048419063957|048419063957|Anagram|"Anagram Foil Balloon 18"" Happy Birthday Smiles"
147|00048481009952|048481009952|Shelton's|Shelton's Turkey Burgers - 3 Ct
148|00072890000309|072890000309|Buckler|Buckler Non-alcoholic Malt Beverage - 6 Ct
149|00070796300035|070796300035|Cento|Cento All Purpose Crushed Tomatoes
150|00041520874061|041520874061|Careone|Careone Vitamin B12 500mcg Tablets - 100 Ct
151|00033776100803|033776100803|Earth Balance|Earth Balance Natural Peanut Butter And Flaxseed Creamy
152|00045587547104|045587547104|Looza|Looza Mango Juice Drink
153|00051000199447|051000199447|Campbell's Go|Campbell's Go Soup Coconut Curry With Chicken & Shitake Mushrooms
154|00013409352311|013409352311|Sweet Baby Ray's|Sweet Baby Ray's Barbecue Sauce
155|00019800036591|019800036591|Renuzit|Renuzit Gel Air Freshener Original
156|00054800344475|054800344475|Uncle Ben's|Uncle Ben's Roasted Garlic Ready Whole Grain Rice Medley
157|00073171006232|073171006232|Howe|Howe Gummi Sour Brites
158|00044000004149|044000004149|Ritz Bits|Nabisco Ritz Bits Cheese Cracker Sandwiches
159|00071072021804|071072021804|Alessi|Alessi Balsamic Reduction Traditional Balsamic
160|00041167413128|041167413128|Allegra|Allegra Allergy 12 Hour Relief Tablets - 12 Ct
161|00010900633376|010900633376|Reynolds|Reynolds Staybrite Baking Cups Flowers - 36 Ct
162|00052100013848|052100013848|Mccormick|Mccormick Grill Mates Brown Sugar Bourbon Marinade
163|00688267132667|688267132667|Ahold|Ahold Cocoa Magic Cereal
164|00744160220051|744160220051|Cocktail|Cocktail Rx Frozen Cocktail Cosmopolitan
165|00033776011895|033776011895|Earth Balance|Earth Balance Natural Buttery Spread Soy Free
166|00046704063316|046704063316|T.g.i. Friday's|T.g.i Friday's Poppers Cream Cheese Stuffed Jalapenos
167|00070158008203|070158008203|Krazy Glue|Instant Krazy Glue - 4 Ct
168|00051000075017|051000075017|Pepperidge Farm|Pepperidge Farm Puff Pastry Turnovers Apple - 4 Ct
170|00051000150769|051000150769|Campbell's|Campbell's Soup On The Go Chicken & Star Shaped Pasta Soup
171|00025000008054|025000008054|Hi-c|Hi-c Boppin' Strawberry Fruit Juice Boxes- 10 Pk
172|00072799831400|072799831400|Werther's Original|Werther's Original Sugar Free Hard Candies
173|00023100017792|023100017792|Cesar|Cesar Canine Cuisine Filet Mignon Flavor
174|00627975010164|627975010164|Freshpet|Freshpet Chilly Wags Natural Vanilla Flavor Frozen Treats For Dogs - 4 Ct
175|00738912022437|738912022437|Boston Market|Boston Market Spaghetti With Meatballs
176|00077544000506|077544000506|Osem|Osem Soup & Seasoning Mix Consomme
177|00041520894281|041520894281|Smart Living|Smart Living Assorted Binder Clips - 10 Ct
178|00721134700245|721134700245|Golden Krust|Golden Krust Jamaican Style Spicy Beef Patties - 2 Ct
179|00024182000894|024182000894|Eden Organic|Eden Organic Shelled & Dry Roasted Pistachios
180|00052100025780|052100025780|Mccormick|Mccormick Grill Mates Mesquite Marinade
181|00635519115015|635519115015|Urban Accents|Urban Accents Fisherman's Wharf Seafood Seasoning
182|00025600002247|025600002247|Tastykake|Tastykake Cream Filled Koffee Kake Cupcakes Family Pack - 12 Ct
183|00041390000034|041390000034|Kikkoman|Kikkoman Soy Sauce
184|00041271024883|041271024883|International Delight|International Delight Coffee Creamer Irish Cream
185|00237194000008|237194000008|Ahold|Ahold Honey Ham - Water Added
186|00041520001641|041520001641|Ahold|Ahold Fitness Grape Creatine
187|00643843200024|643843200024|Premier Protein|Premier Protein Crisp Crunchy Protein Bar Peanut Butter Caramel - 6 Ct
188|00038861090595|038861090595|Whitmor|Whitmor Stacking Shelf White Grid Medium
189|00016000147072|016000147072|Fruit Gushers|Fruit Gushers Fruit Flavored Snacks Value Pack - 12 Ct
190|00079400188977|079400188977|Suave|Suave Naturals Everlasting Sunshine Shampoo
191|00043695103564|043695103564|Hot Pockets|Hot Pockets Sandwiches Cheeseburgers - 4 Ct
192|00020735112298|020735112298|Turkey Hill|Turkey Hill Premium Ice Cream Getrude Hawk Chocolates Box Of Chocolates
193|00870397001603|870397001603|Currant Affair|Currant Affair Black Currant Cranberry Juice
194|00022506474703|022506474703|Spectrum Essentials|Spectrum Essentials Prenatal Dha Softgels - 60 Ct
195|00073416020054|073416020054|Lundberg|Lundberg Risotto Butternut Squash
196|00074699030167|074699030167|Twin Dragon|Twin Dragon Cookies Almond Chinese Style
197|00015000070038|015000070038|Gerber|Gerber Multigrain Cereal
198|00749826539010|749826539010|Pure Protein|Pure Protein Soft Baked Protein Bar Double Double Chocolate Vanilla Crunch
199|00792850233997|792850233997|Burt's Bees|Burt's Bees Green Tea & Lemongrass Hand Soap
200|00074401760320|074401760320|Riceselect|Rice Select Royal Blend Whole Grain
201|00025800023196|025800023196|Weight Watchers|Weight Watchers Smart Ones Smart Delights Strawberry Shortcake - 4 Ct
202|00030000065075|030000065075|Cap'n Crunch|Cap'n Crunch's Peanut Butter Crunch Cereal
203|00073490129414|073490129414|Kedem|Kedem Kids Animal Cookies
204|00051141915302|051141915302|Scotch|Scotch Duct Tape Pearl White
205|00075717952089|075717952089|Rienzi|Rienzi White Clam Italian Style Pasta Sauce
206|00020662000040|020662000040|Newman's Own|Newman's Own Lite Italian Dressing
207|00039978007506|039978007506|Bobs Red Mill|Flour Gf Meal Hzlnut
208|00731493040005|731493040005|Graeter's|Graeter's Ice Cream Peppermint Stick
209|00014100074472|014100074472|Pepperidge Farm|Pepperidge Farm Entertaining Quartet Distinctive Crackers
210|00898425001050|898425001050|Lifestyle Foods|Lifestyle Foods Salad Blt With Ranch
211|00810757010203|810757010203|Bonta D' Italia|Schar Bonta D' Italia Anellini Gluten-free
212|00879890000113|879890000113|Crunchmaster|Crunchmaster Multi-grain Sea Salt Crackers
213|00041200097018|041200097018|Jays|Jays Pork Skins
214|00028989491923|028989491923|Morningstar|Morningstar Farms Grillers California Turk'y Veggie Burgers - 4 Ct
215|00744473470334|744473470334|So Delicious|So Delicious Dairy Free Coconut Milk Frozen Dessert Coconut
216|00037000071297|037000071297|Head & Shoulders|Head & Shoulders 2 In1 Smooth & Silky Dandruff Shampoo + Conditioner
217|00727806012289|727806012289|Dominex|Dominex Veggie Fries Italian Style Eggplant Fries
218|00023923330054|023923330054|Earth's Best|Earth's Best Organic Stage 2 Orange Banana Baby Food Puree
219|00720947004359|720947004359|Soft & Precious|Soft Precious Lavender & Chamomile Nursery Jelly
220|00792850320994|792850320994|Burt's Bees|Burt's Bees Naturally Ageless Line Diminishing Day Lotion
221|00083322015815|083322015815|Alpina|Alpina Revive Blueberry Non-fat Greek Yogurt + Antioxidant Berries
222|00605806028243|605806028243|Green Giant|Green Giant Fresh Rosemary
223|00023700014054|023700014054|Tyson|Tyson Any'tizers Chicken Bites Boneless Buffalo Style
224|00078300057857|078300057857|Playtex|Playtex Nurser Naturalatch Silicone Nipples 3m+
225|00058449860037|058449860037|Envirokidz|Envirokidz Organic Koala Crisp Cereal
226|00060795871933|060795871933|Chef Express|Chef Express Pork Back Ribs Fully Cooked
227|00898115002329|898115002329|Zarbee's|Zarbee's Naturals Children's Cough Syrup Nighttime Natural Grape Flavor
228|00052100005089|052100005089|Mccormick|Mccormick Celery Salt
229|00044000022822|044000022822|Ritz|Nabisco Ritz Crackerfuls Classic Cheddar Filled Crackers - 6 Ct
230|00051700756834|051700756834|Finish|Jet-dry Finish Rinse Agent Green Apple Scent
231|00014800645323|014800645323|Hawaiian Punch|Hawaiian Punch Lemon Berry Squeeze - 6 Pk
232|00043194385737|043194385737|Scunci|Scunci No-slip Grip  Evolution Hair Ties Assorted Colors - 28 Ct
233|00829274007108|829274007108|Meow Mix|Meow Mix Kitten Li'l Nibbles
234|00799210434018|799210434018|Bionaturae|Bionaturae Organic Spaghetti Gluten Free
235|00021000006892|021000006892|Kraft|Kraft Philadelphia Italian Cheese & Herb Cooking Creme
236|00041520875983|041520875983|Companion|Companion Cat Toy Mouse Duo - 2 Ct
237|00856414001092|856414001092|Mayte|Mayte Platanitos Plantain Chips Garlic
238|00070670000495|070670000495|Reese|Reese Whole Water Chestnuts
239|00025484006898|025484006898|Nasoya|Nasoya Tofu Plus Organic Tofu Firm
240|00613008733155|613008733155|Arizona|Arizona Arnold Palmer Lite Half & Half Green Tea Lemonade
241|00310742016574|310742016574|Softlips|Softlips Cube Lip Protectant Pomegranate Blueberry
242|00021131350277|021131350277|Marie Callender's|Marie Callender's Hearty Three Meat Marinara Bake
243|00074182289195|074182289195|Softsoap|Softsoap Body Butter Strawberry Smoother Body Smoothing Wash
244|00041520021878|041520021878|Companion|Ahold Companion Smoky Hambone
245|00688267007538|688267007538|Pure Power|Pure Power Tall Kitchen Bags Handle Tie 13 Gal - 26 Bags
246|00075050006241|075050006241|House Of Tsang|House Of Tsang Flavoring Oil Pure Sesame Seed Oil
247|00052500024031|052500024031|Sauer's|Sauer's Slow Cooker Mix Chili
248|00075609191619|075609191619|Olay|Olay Fresh Effects S'wipe Out! Refreshing Make-up Removal Cloths 20 Count
249|00242008000006|242008000006|Hp Cookie Company|Hp Cookie Company Fancy Cookie Mix
250|00058496019525|058496019525|Pedigree|Pedigree Jumbone Small/medium Snack Food For Dogs - 2 Ct
251|00071153785731|071153785731|Stp|Stp Gas Treatment
252|00024000522539|024000522539|Del Monte|Del Monte Diced Apples & Pears In Extra Light Syrup With Caramel Flavor - 4 Ct
253|00037014242492|037014242492|Endangered Species|Endangered Species Chocolate Milk Chocolate With Almonds Bar Natural - Sandhill Crane
254|00688267033742|688267033742|Ahold|Ahold Conversation Hearts Candy
255|00000000000000|000000000000|Reddi Gourmet|Reddi Gourmet Chicken Breast Italian Style Panko Breaded Boneless Skinless - 4 Ct
256|00041548751504|041548751504|Edy's|Edy's Outshine Fruit Bars Mango - 6 Ct
257|00034000114221|034000114221|Hershey's|Hershey's Special Dark Pieces Dark Chocolate
258|00031604026622|031604026622|Nature Made|Nature Made Fish Oil Liquid Softgels 1000mg - 90 Ct
259|00041520879806|041520879806|Careone|Careone Clifford The Big Red Dog Chunky Grip Toothbrush Extra Soft
260|00610358991020|610358991020|Deerfields Gluten Free|Triple Chip Gluten Free Cookies
261|00041520012807|041520012807|Companion|Companion Dog Toy Plush Bone Puppy Toy With Squeaker
262|00761809039089|761809039089|Firstline|Firstline Evolve Conditioning Cap Platinum
263|00044224023841|044224023841|Afterbite|Afterbite The Itch Eraser Soothing Cream Kids
264|00705105512419|705105512419|Flavrz|Flavrz Tropica Drink Mix Pouches - 6 Ct
265|00014100089476|014100089476|Pepperidge Farm|Pepperidge Farm Baked Naturals Sesame Sticks
266|00077260092021|077260092021|Russell Stover|Russell Stover Assorted Fine Chocolates
267|00041780001566|041780001566|Utz|Utz Kettle Classics Maui Bbq Crunchy Potato Chips
268|00070074580500|070074580500|Pediasure|Pediasure Shake Vanilla - 6 Ct
269|00011509003676|011509003676|Vagisil|Vagisil Medicated Anti-itch Creme Regular Strength
270|00717489750028|717489750028|Milani|Milani Illuminating Face Powder #02 Hermosa Rose
271|00052100107790|052100107790|Mccormick|Mccormick Chili Tex-mex Seasoning Mix
272|00092630010009|092630010009|Mother's Cupboard|Mother's Cupboard Chocolate Chip Cookie Dough
273|00718122681723|718122681723|Lillie Q's|Lillie's Q Barbeque Sauces & Rubs Hot Smoky
274|00028400056588|028400056588|Lay's|Lay's Potato Chips Classic - 6 Ct
275|00024100704965|024100704965|Cheez-it|Cheez-it Baked Snack Crackers White Cheddar
276|00041520203557|041520203557|Giant|Giant Roasted No Salt Peanuts
277|00072900000497|072900000497|Rubinstein's|Rubinstein's Wild Alaska Red Salmon
278|00688267091025|688267091025|Ahold|Ahold Quiche Lorraine
279|00761318046998|761318046998|Revlon|Revlon Coutoure Hair Accessories Elastics - 9 Ct
280|00079927020217|079927020217|Unique|"Unique ""splits"" Split-open Pretzel Extra Dark"
281|00022796918741|022796918741|Ogx|Ogx Body Wash Hydrating Argan Oil Of Morocco
282|00028400028196|028400028196|Doritos|Doritos Nacho Cheese Tortilla Chips
283|00183791000012|183791000012|Weight Watchers|Weight Watchers Bread 100% Whole Wheat
284|00893772001033|893772001033|Wrench|Wrench Mints Sugar-free Candy Cane Peppermint Flavor Box
285|00312843541207|312843541207|Phillips|Phillips' Colon Health Daily Probiotic Supplement Capsules - 60 Ct
286|00070670008231|070670008231|Davinci|Davinci Sun Dried Tomato Pesto
287|00341520319594|341520319594|Careone|Careone Medicated Jock Itch Spray
288|00028400071864|028400071864|Ruffles|Ruffles Baked! Cheddar & Sour Cream Potato Crisps
289|00305210013001|305210013001|Pond's|Pond's Cold Cream Cleanser
290|00078000019636|078000019636|Schweppes|Schweppes Sparkling Seltzer Water Orange - 12 Ct
291|00020662003461|020662003461|Newman's Own|Newman's Own Dressing Lite Sun Dried Tomato
292|00688267001161|688267001161|Acadia|Acadia Sparkling Spring Water Raspberry Lime - 6 Pk
293|00023923700284|023923700284|Earth's Best|Earth's Best Organic Stage 3 Spring Vegetable & Pasta
294|00818512014053|818512014053|Sprout|Sprout Organic Toddler Puree Tropical Oatmeal With Greek Yogurt
295|00084253284264|084253284264|Imagine|Almond Dream Vnla Bite
296|00043168908795|043168908795|Ge|Ge Soft White 40 Watts Decorative Light Bulb
297|00309972330109|309972330109|Revlon|Revlon 33010 Toenail Clip
298|00884912113139|884912113139|Bran Flakes|Post Bran Flakes Cereal
299|00072140015633|072140015633|Nivea|Nivea A Kiss Of Care & Color Lip Care Sheer Caramel
300|00747599607646|747599607646|Ghirardelli|Ghirardelli Chocolate Milk & Carmel Bar
301|00835143001832|835143001832|Ito En|Ito En Oi Ocha Dark Green Tea Unsweetened
